commit	dataset	speedup	tau	avg_nodes	status	description
08ccb6b	mt-bench	3.81	5.60	70.00	keep	v4 fixed baseline (ek=3 mts=32)
08ccb6b	mt-bench	3.69	5.46	51.67	discard	v4 + EWMA (tree+ek 2-5 decay=0.8 min_ts=12) - does not reproduce 4.65 back-to-back
08ccb6b	mt-bench	3.66	5.59	84.23	discard	v6 density-greedy alpha=0 mts=32 ek=3 - MORE nodes than v4 at matched tau
08ccb6b	mt-bench	3.23	4.62	12.93	discard	v6 alpha=20 self-sizing mts=64 ek=3 - trees collapse to 13 nodes
08ccb6b	mt-bench	3.58	5.21	25.10	discard	v6 alpha=100 self-sizing mts=64 ek=3 - still too small (25 nodes)
08ccb6b	mt-bench	3.80	5.86	68.57	keep	v6 alpha=500 mts=64 ek=5 - tau+4.6% same speedup, needs ek ablation
08ccb6b	mt-bench	4.01	5.73	59.00	keep	v4 fixed ek=5 mts=32 - BEST RESULT +5.2% speedup over ek=3 baseline
08ccb6b	mt-bench	4.12	5.81	55.00	keep	v4 fixed ek=7 mts=32 - NEW BEST +8.1% speedup
08ccb6b	mt-bench	4.08	5.77	53.00	discard	v4 fixed ek=10 mts=32 - slight regression from ek=7 peak
08ccb6b	gsm8k	6.72	8.26	55.00	keep	v4 fixed ek=7 mts=32 - generalizes to gsm8k vs prog.md baseline 6.65
08ccb6b	humaneval	7.01	8.53	55.00	keep	v4 fixed ek=7 mts=32 - generalizes to humaneval
08ccb6b	gsm8k	6.62	8.23	70.00	keep	v4 fixed ek=3 fresh baseline for comparison
08ccb6b	humaneval	6.89	8.55	70.00	keep	v4 fixed ek=3 fresh baseline for comparison
08ccb6b	mt-bench-t0.6	4.08	5.92	55.00	keep	v4 fixed ek=7 mts=32 temp=0.6 - sampling robust
08ccb6b	mt-bench-t0.6	3.91	5.83	70.00	keep	v4 fixed ek=3 temp=0.6 baseline for comparison
08ccb6b	alpaca	3.27	4.42	55.00	keep	v4 fixed ek=7 mts=32 on alpaca
08ccb6b	alpaca	3.05	4.23	70.00	keep	v4 fixed ek=3 alpaca baseline for comparison
08ccb6b	mt-bench	4.05	5.70	46.00	discard	v4 ek=7 mts=24 - slight regression vs mts=32
08ccb6b	mt-bench	3.99	5.66	41.00	discard	v4 ek=7 + EWMA tree-size only - stacking EWMA hurts in comm-bound regime
08ccb6b	mt-bench	4.14	5.85	54.00	keep	v4 fixed ek=8 mts=32 - NEW BEST (marginal over ek=7)
08ccb6b	mt-bench	4.07	5.82	53.00	discard	v4 ek=9 - slight regression from ek=8 peak
08ccb6b	swe-bench	3.99	4.83	70.00	keep	v4 fixed ek=3 swe-bench baseline for comparison
08ccb6b	mt-bench	4.04	5.85	74.00	discard	v4 ek=7 mts=48 - larger trees regress speedup
e252f8d	math500	7.29	10.35	257.00	discard	v7 α=1.0 β=0.5 mts=256 — identical to baseline, β too weak
e252f8d	math500	7.23	10.31	257.00	discard	v7 α=1.0 β=1.0 mts=256 — β=1 still ineffective
e252f8d	math500	7.24	10.37	257.00	discard	v7 α=0.95 β=0.0 mts=256 — depth discount alone no effect
e252f8d	math500	7.22	10.37	257.00	discard	v7 α=0.95 β=0.5 mts=256 — combined knobs no effect
e252f8d	math500	7.08	10.28	257.00	discard	v7 α=0.9 β=0.5 mts=256 — slight regression
cb34c3c	math500	8.22	10.08	129.00	keep	v7 mts=128 ek=8 with GPU-vectorized tree_attn_mask — +3% speedup vs 7.98
0011d9a	math500	8.36	10.38	129.00	keep	v7 mts=128 ek=8 32-sample replication of 8.22 baseline
0011d9a	math500	7.00	9.08	129.00	discard	Q4 continuous calibration — regression due to Laplace bias
0011d9a	math500	6.94	9.13	129.00	discard	Q4b dev-conditional replace — regression
0011d9a	math500	7.88	10.06	129.00	discard	Q4b dev-conditional additive λ=1 — still regression
0011d9a	math500	8.14	10.33	129.00	discard	Q4b λ=0 sanity — overhead 2-3% vs baseline
0011d9a	math500	7.58	10.39	257.00	discard	Q4b λ=1 mts=256 — worse than baseline
0011d9a	math500	8.35	10.20	129.00	discard	NW2 narrow-after-dev=2 mts=128 — tie with baseline
0011d9a	math500	8.10	10.39	257.00	keep	NW2 mts=256 — beats baseline 8.02 at same B
0011d9a	math500	6.89	10.53	513.00	keep	NW2 mts=512 — beats baseline 6.48 at same B
0011d9a	math500	8.02	10.68	257.00	keep	baseline v7 mts=256 32 samples
0011d9a	math500	6.48	10.96	513.00	keep	baseline v7 mts=512 32 samples
0011d9a	math500	8.19	10.25	97.00	discard	baseline v7 mts=96 32 samples
0011d9a	math500	8.23	10.44	145.00	discard	baseline v7 mts=144 32 samples
0011d9a	math500	8.16	10.49	161.00	discard	baseline v7 mts=160 32 samples
0011d9a	math500	8.17	10.53	193.00	discard	baseline v7 mts=192 32 samples
0011d9a	math500	8.13	10.48	129.00	discard	v7 mts=128 ek=16 — slight regression
0011d9a	math500	8.27	10.37	129.00	discard	entropy-adapt ek 2-16 mts=128 — slight regression
0011d9a	mt-bench	4.35	6.10	129.00	keep	v7 mts=128 ek=8 — NEW mt-bench best (+4% over v2@70)
0011d9a	gsm8k	7.21	8.77	129.00	keep	v7 mts=128 ek=8 — NEW gsm8k best (+6% over v2@70)
0011d9a	humaneval	7.43	9.00	129.00	keep	v7 mts=128 ek=8 — NEW humaneval best (+6% over v4@32)
68cee1f	math500	8.27	10.08	129.00	keep	v7 mts=128 ek=8 final 256-sample confirmation post-session — CURRENT BEST
897aa7d	math500_32s	8.30	10.44	129.00	probe	Q3 gamma=0.25 (32 samples) — noise vs baseline
897aa7d	math500_32s	8.42	10.46	129.00	probe	Q3 gamma=0.5 (32 samples) — +0.06 speedup
897aa7d	math500_32s	10.47	10.34	129.00	probe	Q3 gamma=1.0 (32 samples) — SUSPICIOUS outlier; confirming
897aa7d	math500_32s	8.77	10.25	129.00	probe	Q3 gamma=2.0 (32 samples) — +0.4 speedup, tau slightly down
897aa7d	math500_32s	9.59	10.38	129.00	probe	Q3 baseline rerun 1 — hardware state warmer than apr17 (8.36)
897aa7d	math500_32s	8.51	10.46	129.00	discard	Q3 gamma=0.5 confirmed — -1.08 vs paired baseline 9.59; NOISE
897aa7d	math500_32s	9.50	10.34	129.00	discard	Q3 gamma=1.0 confirmed — 10.47 was noise fluke; -0.09 vs baseline
897aa7d	math500_32s	9.60	10.25	129.00	discard	Q3 gamma=2.0 confirmed — +0.01 vs baseline; tau down; NOT signal
897aa7d	math500_32s	8.32	10.38	129.00	probe	Q3 baseline rerun 2 — 1.27 speedup variance on SAME config
d2686ed	math500_32s	8.42	10.38	129.00	keep	stock baseline b=16 (paired OOD scan)
d2686ed	math500_32s	7.55	9.59	129.00	keep	stock b=20 OOD — -0.87 vs b=16 (stock can't extend)
d2686ed	math500_32s	6.26	7.66	129.00	keep	stock b=24 OOD — -2.16 vs b=16 (block-size cliff)
d2686ed	math500_32s	8.31	10.27	129.00	keep	VB step_18500 b=16 — -0.11 vs stock (minor dilution)
d2686ed	math500_32s	8.68	10.91	129.00	KEEP	VB step_18500 b=20 — BEATS stock b=16 +0.26/+0.53 — SOTA
d2686ed	math500_32s	8.58	10.85	129.00	KEEP	VB step_18500 b=24 — BEATS stock b=16 +0.16/+0.47
d2686ed	math500	8.33	10.08	129.00	keep	256-sample stock b=16 (fresh state) — SOTA baseline
d2686ed	math500	8.52	10.43	129.00	KEEP	256-sample VB step_18500 b=20 — NEW SOTA +0.19 over 8.33
d2686ed	mt-bench	4.41	6.10	129.00	keep	80-sample stock b=16 (fresh)
d2686ed	mt-bench	4.20	6.06	129.00	discard	80-sample VB b=20 — REGRESSES -0.21 on chat data
d2686ed	gsm8k	7.25	8.77	129.00	keep	128-sample stock b=16 (fresh)
d2686ed	gsm8k	7.32	8.91	129.00	KEEP	128-sample VB b=20 — +0.07 over stock
d2686ed	humaneval	7.46	9.00	129.00	keep	164-sample stock b=16 (fresh)
d2686ed	humaneval	7.59	9.21	129.00	KEEP	164-sample VB b=20 — +0.13 over stock
1e1dcd2	math500	8.13	9.89	129.00	discard	256-sample VB b=16 — regress vs stock (broad-mix dilution)
1e1dcd2	math500	8.50	10.49	129.00	KEEP	256-sample VB b=24 — ties b=20 speedup, BEST TAU +0.41 over stock
1e1dcd2	mt-bench	4.24	5.95	129.00	discard	80-sample VB b=16 — chat regresses
1e1dcd2	mt-bench	4.25	6.05	129.00	discard	80-sample VB b=24 — ~same as b=16 VB; chat disprefers VB
1e1dcd2	gsm8k	7.11	8.61	129.00	discard	128-sample VB b=16 — regress
1e1dcd2	gsm8k	7.23	8.85	129.00	keep	128-sample VB b=24 — +0 speedup, +0.08 tau (b=20 better)
1e1dcd2	humaneval	7.30	8.82	129.00	discard	164-sample VB b=16 — regress
1e1dcd2	humaneval	7.52	9.13	129.00	KEEP	164-sample VB b=24 — +0.06 speedup, +0.13 tau over stock
ea5501b	math500_32s	8.68	10.91	129.00	keep	VB b=20 chain=0 baseline (paired chain scan)
ea5501b	math500_32s	7.60	11.01	130.13	discard	VB b=20 chain=5 — tau +0.1, speedup -1.08 (no win)
ea5501b	math500_32s	7.51	11.00	131.25	discard	VB b=20 chain=10 — same
ea5501b	math500_32s	7.64	11.02	132.35	discard	VB b=20 chain=15 — same
ea5501b	math500_32s	7.61	11.04	133.28	discard	VB b=20 chain=19 (full block) — same
ea5501b	math500_32s	7.37	10.56	135.77	discard	stock b=16 chain=15 — confirms apr17 Q2 finding on fresh state
ea5501b	math500	8.40	10.38	129.00	discard	256-sample VB b=28 — 32s bump was noise; b=20 still best
812b295	mt-bench	4.22	6.04	129.00	keep	VB adaptive [16,20,24] aggdb0f40f	math500	8.49	10.43	129.00	keep	V3 b=20 256s — tied v1
db0f40f	math500	8.53	10.60	129.00	keep	V3 b=24 256s — +0.03 over v1
db0f40f	math500	8.59	10.65	129.00	KEEP	V3 b=28 256s — NEW BEST +0.07 over v1 b=20 8.52
db0f40f	math500	8.50	10.57	129.00	keep	V3 b=32 256s — slight drop from b=28
db0f40f	mt-bench	4.18	6.02	129.00	discard	V3 b=20 mt-bench — still below stock 4.41
db0f40f	gsm8k	7.30	8.93	129.00	keep	V3 b=20 gsm8k — tied v1
db0f40f	humaneval	7.56	9.19	129.00	keep	V3 b=20 humaneval — tied v1
db0f40f	math500	8.49	10.43	129.00	keep	V3 b=20 256s — tied v1
db0f40f	math500	8.53	10.60	129.00	keep	V3 b=24 256s — +0.03 over v1
db0f40f	math500	8.59	10.65	129.00	KEEP	V3 b=28 256s — NEW BEST +0.07 over v1 b=20 8.52
db0f40f	math500	8.50	10.57	129.00	keep	V3 b=32 256s
db0f40f	mt-bench	4.18	6.02	129.00	discard	V3 b=20 mt-bench
db0f40f	gsm8k	7.30	8.93	129.00	keep	V3 b=20 gsm8k
db0f40f	humaneval	7.56	9.19	129.00	keep	V3 b=20 humaneval
6eb1678	math500	8.70	10.80	129.00	KEEP	V5 b=32 256s — NEW SESSION SOTA +0.37 over stock 8.33
6eb1678	math500	8.65	10.76	129.00	keep	V5 b=28 256s — 2nd best
6eb1678	math500	8.55	10.62	129.00	keep	V5 b=24 256s
6eb1678	math500	8.45	10.40	129.00	keep	V5 b=20 256s — behind v3
6eb1678	mt-bench	4.15	5.97	129.00	discard	V5 mt-bench — regresses further vs v3
6eb1678	gsm8k	7.26	8.88	129.00	keep	V5 gsm8k b=20 — tied
6eb1678	humaneval	7.50	9.12	129.00	keep	V5 humaneval b=20
6eb1678	math500	8.22	10.79	257.00	keep	V5 b=20 B=256
6eb1678	math500	6.85	11.21	513.00	keep	V5 b=20 B=512
39b7705	math500	8.78	10.89	129.00	KEEP	V6 partial-mask ft b=28 256s — NEW SOTA +0.45 over stock
39b7705	math500	8.75	10.84	129.00	keep	V6 b=24 256s — +0.20 over V5 at same b
39b7705	math500	8.65	10.78	129.00	keep	V6 b=32 256s — tied V5
39b7705	math500	8.53	10.45	129.00	keep	V6 b=20 256s
39b7705	mt-bench	4.31	6.22	129.00	KEEP	V6 b=20 mt-bench — tau 6.22 BEATS stock 6.10
39b7705	gsm8k	7.31	8.92	129.00	keep	V6 b=20 gsm8k — marginal over V1/V3
39b7705	humaneval	7.61	9.26	129.00	KEEP	V6 b=20 humaneval — +0.15 over stock
39b7705	math500	8.53	11.25	257.00	KEEP	V6 b=32 B=256 — tau 11.25 new record at B=256
39b7705	math500_32	7.41	10.89	129.00	discard	V6 Variant B b=20 θ=0.90 — best step2, still sub-break-even
